{
  "$schema": "api/schema/release-manifest.schema.json",
  "schema_version": "1.0.0",
  "product_name": "Sheaft",
  "app_version": "0.2.1",
  "git_commit": "cff469bbc6fda223443acd070d4783510037c114",
  "build_date": "2026-03-22T14:39:43Z",
  "binaries": [
    {
      "os": "darwin",
      "arch": "amd64",
      "archive": {
        "path": "dist/sheaft_0.2.1_darwin_amd64.tar.gz",
        "sha256": "6d7b6dda1e63a49c2a7cbfe84fcd4b578b612229e9cd79bc0802e6bb2b0b8a3c"
      },
      "sbom": {
        "path": "dist/sheaft_0.2.1_darwin_amd64.tar.gz.sbom.json",
        "sha256": "723af9f6cdfa1b6e4d9c5cc214d5abc96ed9cc7c3c99229b28207145ba8c5f89"
      }
    },
    {
      "os": "darwin",
      "arch": "arm64",
      "archive": {
        "path": "dist/sheaft_0.2.1_darwin_arm64.tar.gz",
        "sha256": "c4097bbf439d59436d3871246448dad59d7e7866ff3978e3602e81b5eb56d2fa"
      },
      "sbom": {
        "path": "dist/sheaft_0.2.1_darwin_arm64.tar.gz.sbom.json",
        "sha256": "10e5900c986cc69e8fe5fb2480f754e0cfef5547ef4d10ea4981cf22a2eb9f8e"
      }
    },
    {
      "os": "linux",
      "arch": "amd64",
      "archive": {
        "path": "dist/sheaft_0.2.1_linux_amd64.tar.gz",
        "sha256": "0c29493ce28a50a2906e1c00fd0c06612c9197d2d1ae8021917b276896e30432"
      },
      "sbom": {
        "path": "dist/sheaft_0.2.1_linux_amd64.tar.gz.sbom.json",
        "sha256": "89333f61d687b6f1a079ec062cd2eca25e4fb1356de81165e665bbf27a2ed722"
      }
    },
    {
      "os": "linux",
      "arch": "arm64",
      "archive": {
        "path": "dist/sheaft_0.2.1_linux_arm64.tar.gz",
        "sha256": "826d6553418fc9158db0c42db3ceb1048ab2740a3ded8868ee90399d50a3f926"
      },
      "sbom": {
        "path": "dist/sheaft_0.2.1_linux_arm64.tar.gz.sbom.json",
        "sha256": "809bbbb5e69d6b1c4ae0fbafc0e40b6bbd93d85921829fcb94fa95ca3c181020"
      }
    },
    {
      "os": "windows",
      "arch": "amd64",
      "archive": {
        "path": "dist/sheaft_0.2.1_windows_amd64.zip",
        "sha256": "5e409bca3378730f07216aeb619362751168a2a809f6202126d079d592e43603"
      },
      "sbom": {
        "path": "dist/sheaft_0.2.1_windows_amd64.zip.sbom.json",
        "sha256": "51d53584af6cb223a4476065ba6af5a03de743176d15c6ebab46f5e6cd9d9e73"
      }
    }
  ],
  "checksums_file": {
    "path": "dist/sheaft_0.2.1_checksums.txt",
    "sha256": "845448ddface4e8dcd1defb068c2af1eceae3a0d325d6955054fa4f8b4bd7a56"
  },
  "oci_images": [
    {
      "schema_version": "1.0.0",
      "repository": "ghcr.io/mb3r-lab/sheaft",
      "tags": [
        "v0.2.1",
        "v0.2",
        "sha-cff469bbc6fda223443acd070d4783510037c114"
      ],
      "platforms": [
        "linux/amd64"
      ],
      "published": false,
      "references": [
        {
          "reference": "ghcr.io/mb3r-lab/sheaft:v0.2.1"
        },
        {
          "reference": "ghcr.io/mb3r-lab/sheaft:v0.2"
        },
        {
          "reference": "ghcr.io/mb3r-lab/sheaft:sha-cff469bbc6fda223443acd070d4783510037c114"
        }
      ]
    }
  ],
  "chart": {
    "schema_version": "1.0.0",
    "name": "sheaft",
    "version": "0.2.1",
    "published": false,
    "archive": {
      "path": "dist/charts/sheaft-0.2.1.tgz",
      "sha256": "d4358b0ccf31d6c83e94d999900da5595b00cf0b82f8cb642985034fde2fb676"
    }
  },
  "compatibility_manifest": {
    "path": "compatibility-manifest.json",
    "sha256": "d6a7b7413081eaa5771e67647908ac383316f661662ddd80e0a9c2269b7c050e"
  },
  "default_config_packs": [
    {
      "schema_version": "1.0.0",
      "name": "default-config-pack",
      "version": "0.2.1",
      "archive": {
        "path": "dist/sheaft-default-config-pack_0.2.1.tar.gz",
        "sha256": "1a0ce2a7812b8ab6558ca43b5d930758d645b32a229efaaeff965dbb0be899af"
      },
      "files": [
        "configs/analysis.example.yaml",
        "configs/analysis.v1.1.example.yaml",
        "configs/fault-contract.example.yaml",
        "configs/gate.policy.example.yaml",
        "configs/predicate-contract.example.yaml",
        "configs/sheaft.example.yaml",
        "examples/otel/journeys.sample.json",
        "examples/outputs/model.sample.json",
        "examples/outputs/model-v1.1.0.sample.json",
        "examples/outputs/snapshot.sample.json",
        "examples/outputs/snapshot-v1.0.0.sample.json",
        "examples/outputs/snapshot-v1.1.0.sample.json",
        "examples/outputs/report.sample.json",
        "examples/outputs/posture-generated/report.json",
        "examples/outputs/posture-generated/summary.md"
      ]
    }
  ]
}
